<?xml version="1.0" encoding="UTF-8"?>
<UpdateAquireOrderResponse xsi:schemaLocation="http://www.dkma.dk/medicinecard/xml.schema/2014/06/01 UpdateAquireOrderResponse.xsd" xmlns="http://www.dkma.dk/medicinecard/xml.schema/2014/06/01" xmlns:xsi="http://www.w3.org/2001/XMLSchema-instance">
	<PersonIdentifier source="CPR">1111111118</PersonIdentifier>
	<MedicineCardVersion>1341404078102001002</MedicineCardVersion>
	<VersionMismatchWarning/>
	<AquireOrder>
		<Identifier>1341404077656004002</Identifier>
		<Version>1341404078102001003</Version>
		<VersionMismatchWarning/>
	</AquireOrder>
</UpdateAquireOrderResponse>
